{
  "id": "persona_1759472350",
  "name": "abc",
  "core_traits": {
    "temperament": "balanced",
    "values": [
      "geh"
    ],
    "motivations": []
  },
  "voice": {
    "tone": "",
    "patterns": [],
    "vocabulary": "standard"
  },
  "background": {
    "origin": "",
    "significant_events": [],
    "connections": []
  },
  "knowledge": {
    "expertise": [],
    "limitations": [],
    "lore_books": []
  },
  "interaction_style": {
    "formality": "neutral",
    "humor": "occasional",
    "directness": "balanced",
    "special_instructions": ""
  },
  "meta": {
    "version": "1.0",
    "created": "2025-10-03T06:19:10Z",
    "modified": "2025-10-03T06:19:10Z",
    "tags": []
  }
}
